{
  "schemaVersion": "1.1.0",
  "subscriptionId": "00000000-0000-0000-0000-000000000000",
  "status": "scheduled",
  "facilitatorApprovalRequired": true,
  "plans": [
    {
      "name": "CloudPosture",
      "priorPricingTier": "Free",
      "priorSubPlan": null,
      "priorEnforce": "False",
      "priorExtensions": []
    },
    {
      "name": "Containers",
      "priorPricingTier": "Free",
      "priorSubPlan": null,
      "priorEnforce": "False",
      "priorExtensions": []
    },
    {
      "name": "SqlServers",
      "priorPricingTier": "Free",
      "priorSubPlan": null,
      "priorEnforce": "False",
      "priorExtensions": []
    },
    {
      "name": "OpenSourceRelationalDatabases",
      "priorPricingTier": "Free",
      "priorSubPlan": null,
      "priorEnforce": "False",
      "priorExtensions": []
    },
    {
      "name": "VirtualMachines",
      "priorPricingTier": "Free",
      "priorSubPlan": null,
      "priorEnforce": "False",
      "priorExtensions": []
    }
  ],
  "priorPricings": {
    "file": "workshop/contracts/fixtures/defender/pricings-before.json",
    "sha256": "3fef490ee04911a08ed26755b3cb433ac51fe1ed67d54e56dcff67bbe63b154c"
  },
  "priorCleanupInventory": {
    "file": "workshop/contracts/fixtures/defender/cleanup-inventory-before.json",
    "sha256": "cd7e40ed8335a82b2825cf0299239e89313dc8e49f3f93ad83046bb1ecce53c0"
  },
  "costVerification": {
    "status": "scheduled",
    "billingDataMayLag": true
  }
}
